{
	"meta": {
		"version": "0.0",
		"song": {
			"title": "FÃ¼r Elise",
			"artist": "Ludwig van Beethoven",
			"composers": [
				"Ludwig van Beethoven"
			]
		},
		"source": {
			"collection": "collection",
			"filename": "example.yaml",
			"format": null,
			"id": "0"
		}
	},
	"timing": {
		"is_symbolic_timing": true,
		"beat_resolution": 4
	},
	"time_signatures": [
		{
			"time": 0,
			"numerator": 3,
			"denominator": 8
		}
	],
	"key_signatures": [
		{
			"time": 0,
			"root": "A",
			"mode": "minor"
		}
	],
	"tempos": [
		{
			"time": 0,
			"tempo": 120
		}
	],
	"downbeats": [
		4,
		16
	],
	"lyrics": [
		{
			"time": 0,
			"lyric": "nothing but a lyric"
		}
	],
	"annotations": [
		{
			"time": 0,
			"annotation": "nothing but an annotation"
		}
	],
	"tracks": [
		{
			"name": "melody",
			"program": 0,
			"is_drum": false,
			"notes": [
				{
					"start": 0,
					"end": 2,
					"pitch": 76,
					"velocity": 127
				},
				{
					"start": 2,
					"end": 4,
					"pitch": 75,
					"velocity": 127
				},
				{
					"start": 4,
					"end": 6,
					"pitch": 76,
					"velocity": 127
				},
				{
					"start": 6,
					"end": 8,
					"pitch": 75,
					"velocity": 127
				},
				{
					"start": 8,
					"end": 10,
					"pitch": 76,
					"velocity": 127
				},
				{
					"start": 10,
					"end": 12,
					"pitch": 71,
					"velocity": 127
				},
				{
					"start": 12,
					"end": 14,
					"pitch": 74,
					"velocity": 127
				},
				{
					"start": 14,
					"end": 16,
					"pitch": 72,
					"velocity": 127
				},
				{
					"start": 16,
					"end": 18,
					"pitch": 69,
					"velocity": 127
				}
			],
			"lyrics": [
				{
					"time": 0,
					"lyric": "nothing but a lyric"
				}
			],
			"annotations": [
				{
					"time": 0,
					"annotation": "nothing but an annotation"
				}
			]
		}
	]
}
